yorum,kategori
"ürün elime çok çabuk ulaştı. çekim gücü gayet içi, çok hafif ve kullanımı çok rahat. malzemeleri çok kaliteli değil. ayrica alalı 1 ay olmadan kablo toplama sistemi nedense bozuldu. kablolar dışarıda.bu durum sizi rahatsız etmez ise alın derim.",Olumsuzlama
hepsi burada bu konuda harika.her sipariste çok memnun kaldım,Bağlamsal/Diğer
eksileri :1- yan kıvrımları ben kendimden dolayı sanıyordum ama genel olarak herkez şikayetci kıvrımlar belli bir süre sonra açılıyor.,Bağlamsal/Diğer
siyah zeminde tutukluk yapiyor cok ilginc geldi bana normalde logitech m600 kullaniyordum hic bir sorunum yoktu ama mouseda sorun yasadim eger bunu alacaksaniz beyaz zemini hazirlayin :),Olumsuzlama
"ürün fotoğrafındaki gibi çok kancası yok, 6 kanca ile geliyor, karşılıklı yük dengesi yapmanız gerekiyor, fakat işe yarıyor. kullanışlı.",Olumsuzlama
"bıçak aşağı yukarı oynuyor,arka kapak emanet duruyor.kilit mekanizması oynuyor...",Bağlamsal/Diğer
uzatma hortumlarını takmak tam bir eziyet. çünkü çok çukurda. diğer yönlerden güzel,Bağlamsal/Diğer
türksit ferrari modeli bir oyuncu koltuğu aldım direk ayakları yamuldu. bu yedek parçayı alacağınıza biraz daha para verip metalini alın derim.,Bağlamsal/Diğer
"ürünü 2 hafta önce aldım, arabamın camına ıslatarak vakumladım ıslatmadan yaparsanız biraz zor ve sağlıksıznolur yoksa bir sorun yok düşünmeden alabilirsiniz.",Olumsuzlama
"bu ürüne benzer aparatı bir holding binasında arkadaşımı ziyarette elimi yıkarken gördüm,nalburlarda ve yapı elemanı mağazalarında(büyük mağazalar)aradım ama fıskiye özellikli olanını arıyordum,sadece burada bulabildim.ürün siparişten sonra 4. günde elime geçti.3 adet almıştım.evimde 2 lavabo ve bir mutfak bataryasına bağladım.söylendiği gibi fıskiyeli akış yapıyor.ancak uzun süre uğraşmama rağmen o bahsettikleri volüme kontrol işinin işe yaramadığını gördüm.yani suyun debisini o vidayla değil,sadece bataryanın altındaki vanalarla sağlayabiliyorsunuz.yani o ayar vidası defalarca üçünü de denedim ve kronometre tuttum,neredeyse aynı.ancak bataryanızın ayar vanasından suyun debisini elinizle ayarlarsanız hakikaten saniyesi saniyesine 1 dakikada ister 2 lt,ister 4 lt yapabiliyorsunuz.normal bataryamın ucunu(suyu köpürten cinsten olan)denedim,1 lt suyu 4 saniyede doldurdu,tasarrufu siz düşünün.eksi yönü ise,kombinin çalışması için şebeke suyunuzun tazyikli ve batarya vanalarınızın tamamen açık olması gerekiyor.yani suyu dakikada 2 lt olsun diye ayarlarsanız sıcak suyu çalıştırmaya yetmiyor.elektrikli termosifon için birebir ancak kombi zaten devreye bile girmiyor.sadece sebeke son ve vana son düzeyde açıksa kombi devreye giriyor o zaman da su sarfiyatı 4-5 lt oluyor.deney gibi oldu ama baya bi bilgi edindim,siz de edinin istedim.ama gerçekten su tasarrufunda birebir.",Olumsuzlama
uzun yıllar kullandım.boyut olarak bir tam ekmeği ikiye bölüp veya 4 adet tost ekmeğini basabilirsiniz.çabuk ısınıyor ve plakalar çıktığı için temizlemesi kolay. en kötü tarafı ise tutma kısmından bastırdığınızda arkadan atıyor ve tam olarak bastırmıyor ben üzerine bez koyarak tam ortadan bastırmaktan yamuldu attım. yenisini daha kalitelisinden aldım.,Karma Duygu
delta çok fonksiyonlu deluxe kapı barfiksi + mekik & şınav çekme aleti - ds 1325 ürün süper hızlı gönderi deniliyor ama 3 gün geçti hala kargoya verilmedi lütfen kargo işlemini gerçekleştirin,Bağlamsal/Diğer
bu telefonda begendigim ozellikler de var ama en nefret ettigim ettigim ozellik cok cabuk pilinin bitmesi daha 1 saat gecmeden 100de 100 ken 100de 40 oluyor...,Bağlamsal/Diğer
tarama hızı iyi. fotokopiyi de güzel çekiyor.,Bağlamsal/Diğer
"en önemli nokta 1200 mah batarya içinde yok. ben batarya ile bu fiyata değer dedim aldım, batarya yokmuş, iade ettim. ama yinede herkesin zevki farklı.",Olumsuzlama
"arkadaşlar, telefonu tutan hazne yukarı kaldırıldığında hemen çıkıyor. telefonunuzu almak için bir müdahale ettiğinizde elinizin çarpması halinde düşebilir. veya bir tümsekten geçmede sıkıntı yaratabilir.",Bağlamsal/Diğer
isigi biraz az ama cok pratik . fiyat cok cazip,Bağlamsal/Diğer
"çok uzun yıllar armani kullandıktan sonra bu parfümüde gözü kapalı alabileceğimi düşündüm ama çokta beklediğim gibi çıkmadı. klasik armani kokuları gibi fresh ve hafif değil, çok şekerli bir koku... beni rahatsız etti ancak bayanı çok daha güzel...",Olumsuzlama
icin cok ideal telefondan memnunum,Bağlamsal/Diğer
"kömürün üzerine döktüm. yakmadı, ateşi söndürdü!",Bağlamsal/Diğer
i̇lk olarak çok ağır ve sesli. süpürgede beni rahatsız eden en önemli konu ise ucunun üçgen olması oldu. supurdugunuz odada sadece 4 yada 6 köşe varken düz duvarların olduğu bölgeleri supururken ucu duvara degdiğinden baya bir bölgeyi supurebolmek için manevralar tapmak zorunda kalınıyor. ek aparat olarak düz uç da gönderseler harika olurdu,Bağlamsal/Diğer
bu üründen ikinci kez sipariş ediyorum. i̇lk siparişim kullanım esnasında patladı. piyasada daha kalitelisini bulamadığım için ikinci bir şans daha veriyorum aynı ürüne. bu kez musluğu daha kısık açarak deneyeceğim. kullanıcılara tavsiyem hortuma giriş musluğunu sonuna kadar açmamamalarıdır. hortumun dış kumaş yapısının altında lastikten bir boru mevcut. bu boru suyla dolunca genişleyerek hortumun uzamasını sağlıyor. kullanılan lastik materyal basınca daha dayanıklı üretilmiş olsa hortum uzunca bir süre keyifle kullanılabilirdi.,Yazım Bozukluğu
shellden aldım kullandıktan sonra yakıt düştü bujilere baktım çok güzel çıktı fakat arabam kattiktan sonra biraz yağ eksildi,Bağlamsal/Diğer
ürün yeni elime geçti ambalaj diye bir olay yok kutu ağırlıktan dolayı darmadağın olmuş eve nasıl götüreceğim kara kara düşünüyorum doğrusu,Olumsuzlama
ne 100 metresi 10 metrede çekmedi.,Bağlamsal/Diğer
"bir sd kart neden kötü olabilir ki denebilir, ama akıllı telefonumu ve beni delirtti :) sd kart bir var bir yok oluyor. düzenlediğim dosyalarım sürekli gidiyor ve ve görünür olduğunda da düzenlemeler kaybolmuş oluyor, sürekli aynı şeyleri tekrar tekrar yapıyorum. aynı telefonda bir çok kart denedim, samsung gibisi çıkmadı.",Olumsuzlama
ürün paspas üzerinde bulunan ufak taşları ve kum gibi maddeleri çekiyor. araç için idare edecek bir ürün. en kötü yanı çektiği tozların bir bölümünü dışarı vermesi. bu durum özellikle güneş ışığı altında çok daha belli ediyor kendini.bazen bir şey çekmiyormuş gibi gelebilir bu durumda haznesini boşalttığınız da yanıldığınızı göreceksiniz. :),Bağlamsal/Diğer
"objektifin otomotik af motoru bulunmadığından nikonun bazı modellerinde manuel netleme yapmak zorundasınız. bu fotoğraf makinaları d40, d40x, d60, d3000, d5000, d3100, d5100 dir. bu makinalar ile birlikte kullanacaksanız otomotik netlemeyi unutmanız gerekir.",Bağlamsal/Diğer
"sadece arka koltuğa bağlama aparatı var, ön koltuk başlarına bağlanmadığı için ürün çabuk dağılıyor, koltuğa sabitlenmiyor.",Bağlamsal/Diğer
ben de bu epilatörü almayı düşünüyorum yorumlarınızı okudum ama benim için pek açıklayıcı olmadı.lütfen benim için biraz daha yazı yazın ve lütfen bana onay atın.....,Olumsuzlama
"bugüne kadar hepsiburadadan 10a yakın demonte mobilya almışımdır. daha önce böyle kalitesiz bir ürün görmemiştim. resimdeki görüntü çok yanıltıcı, gerçeği o kadar ufak ki resmen çocuk mobilyası gibi. aynası ise kesinlikle masaya monte edilemiyor, duvara dayarsınız ya da duvara monte edersiniz. mobilya parçalarının üzerinde monte için numara yoktu ve eksik parçalar vardı.",Olumsuzlama
"üç adet sipariş verdim hızlı kargo için teşekkür ederim lakin eksikler mevcut abartıldığı kadar iyi değil sebep : ses boğuk geliyor tam olarak ses alabilmeniz için sesi biraz azaltmak gerekebiliyor , şarj girişi devamlı açık üzerindeki ufak ped kati suretle kapansada açılıyor, sesi kristalleştirdiği falan yok :d bildiğin ses :d gürültüyü temizlemesi falan tamamiyle hikaye :d şarj süresi yeterli gerçekten ilk aldığım günden beri şarja takmadım ve günde 3 saat minimum görüşme yapan bir insanım ...",Olumsuzlama
"hızlı gönderim için teşekkürler ürün gayet kullanışlı, şık ve güzel fakat aynı ürünü hemde aynı marka olmasina rağmen ankarada çok daha ucuza bulmam beni biraz üzdü açıkçası yine de tesekkürler :)",Bağlamsal/Diğer
"arada kendi kendine düsüyor, biraz korkutucu :)",Bağlamsal/Diğer
"yaklaşık bir yıldır kullanıyorum. ürün elinize ulaştığında lüks tasarımı şaşırtıyor. gayet güzel fakat gereksiz olduğunu düşündüğüm çok parça var, mesela taşıma kesesi, dijital sayaç, başlık konulacak apart... bunların fiyatı gereksiz artırdığını düşünüyorum. şarjı az gidiyor ve yeniden şarj olmazı upuzun sürüyor (12+ saat). en önemli eleştirim ise taşıma kutusu çok çabuk macun lekesi tutuyor ve gerçekten temizlenmiyor! sözün kısası şudur; fırçası gerçekten müthiş! tasarım harikası! fakat geride kalan aparatlar fiyatı artıracak ve hiçbir işe yaramayacak.",Olumsuzlama
ayrıca turbolu araçlarda motora koyduktan sonra lifter sesi gelmeye başlıyor bunun sebebi subapların önünü kaplaması böylelikle yağın iyi şekilde pompalanmasına mani olması diye düşünüyorum.,Bağlamsal/Diğer
arkadaşlar bende fiyat uygun diye aldım site güvenlik istemide kullanılmak üzere biraz küçük oldu ama güzel. mutfak için güzel tavsiye ederim.,Bağlamsal/Diğer
bir kredi kartından kalın! bıçak yapıştırma ile içine gömülmüş. ben cebime koyarım gerektiğinde kullanırım diyorsan işini görür ama masada otururken elimde oyuncak gibi oynayacam. sürekli kullanacağım dersen dayanmaz bence. çünkü yapıştırma bir ürün. ve ara kısımları kaynak bana ileride kopacakmış hissini veriyor,Bağlamsal/Diğer
benim icin önemli olan kaymasiydi ütünün ama ne yazikki sanki kumasa yapisiyor. cok pismanim aldigima,Bağlamsal/Diğer
ürünü alalı 2 hafta oldu temizlik konusunda 10 numara.ammaaaaaaaaaa çok fazla ses çıkarıyor ve oldukça hantal(kocaman).yine belirteyim diğer makinemle boşuna temizlik yapıyormuşum.ardından toz bırakma olayı yok.seçiminizi ona göre yapın.,Olumsuzlama
2 km civarı menzili var. en kaliteli pili takmama rağmen birkaç saatlik kullanımda ışık zayıfladı. i̇zi çok ince lazerin. çocukken bayramlarda aldığımız kırmızı lazerler gibi.,Bağlamsal/Diğer
dün elime ulaşan bu parfum kesınlıkle orjınal degıl. koku yok bile. dolum parfum alsam 2 saat en azından yogun kokusu var. bunun 10 dk bile kokusu yayılmıyor. kendı burnunuza bıle gelmıyor,Olumsuzlama
"donusu ayarlayan aparat sabit sadece 45 derecelik bir aciya izin veriyor, ya da cikartip tam tur attirabiliryorsunuz, arasi mumkun degil, eger tam tura uygun bir sulama alanininiz yoksa, takip unutuamiyorsunuz, 2-3 defa yarini ya da yonunu degistirmeniz gerekiyor.",Olumsuzlama
sipariş verdik elime ulaştığında olumlu veya olumsuz değerlendirmelerim olacaktır...,Yazım Bozukluğu
"ürünü perşembe akşamı sipariş ettim cumartesi günü elime ulaştı. daha önceden de kullandığım bir parfümdü indirimi görünce bu sefer orijinal alıyım dedim ama şu an bir daha mı düşünseydim diyorum. sorun şu ki parfüm gerçekten hafif kalıcılığı çok az, çok güzel koksa da bu büyük bir handikap. sanırım bir sonraki parfümümde başka markalara yönelicem.",Bağlamsal/Diğer
"arkadaşlar, bu ürünü bu gün aldım. merakımdan hemen evi süpürdüm. hiç çekiş gücü yok gibi ama, su acayip kirlendi nerden geldi o kir şaşırdık. belkide suya çekme sistemlerinin hepsinin çekişi zayıftır, bilmiyorum. valla fena değil, inşallah uzun ömürlü olur. alanlara, ve bize hayırlı olsun. ihtiyacı olan alsın selamlar......",Olumsuzlama
"kamera, album uygulamasi arasinda gecislerde sikinti var.",Bağlamsal/Diğer
hediye almıştım çok çok ağır bir kokusu var. daha güzel bir koku bekliyordum. kokunun uzun süre kalabilmesi için çok ağır yapılmış,Bağlamsal/Diğer
"oldukça fazla korku ve gerilim kitabı okudum. bence çok sıradan bir kitap, beklentimin çok altında...",Bağlamsal/Diğer
"paketi açıp ürünü çıkardıktan sonra kolları sıvayıp uygulama videosu eşliğinde itina ile yapıştırdım ekrana. öncesinde öyle titizlikle sildim ki ekranı aşındı neredeyse. neyse aynen anlatıldığı gibi yaptıktan sonra şöyle bir baktım telefona ve ilk denememde hallettim diye sevindim. çünkü gayet güzel ortalanmıştı ve tek bir toz veya kabarcık kalmamıştı koruyucunun altında. yapıştırıp tekrar kaldırmamıştım da tek defada oturtmuştum. ne olur ne olmaz diye kavisli kenarlardan belki 15-20 dakika boyunca bastırdım. koydum masanın üzerine, yarım saat sonra baktığımda ne göreyim? bildiğin kanatlanmış telefon, kavisli kenar kavramını ortadan kaldırmış koruyu ve düzlemiş kendini. eğer bu şekilde kullanmak hoşuma gider derseniz tavsiye ederim.",Olumsuzlama
patates dilimlemesi hoşuma gittiği için tercih etmiştim ama patatesler güzel dilimleniyor yalnız biraz ufak sanki. onun haricinde havuç veya patales resndelemesi güzel.soğan dilimlemede güzel. güzel bir rendeleyici. vakitten kazandırıyor.,Bağlamsal/Diğer
birde mouse 0.5cm kaldırdığınızda bile tepki veriyor.,Bağlamsal/Diğer
snapdragon 2xx kullanıyor işlemci olarak. akıllı saatler bile kullanmıyor bu işlemciyi.,Bağlamsal/Diğer
normal yatağın konforuna ulaşması tabiki imkansız. yinede kullanıldığında çok uygun ve rahat. dönüşlerde rahatsız edici bir ses çıkarıyor ama uykudan uyandırmıyor. düşme riskide yok. kolay şişiyor ama indirmesi biraz uğraşlı. ansızın gelen misafirler için kurtarıcı rolünü üstleniyor. en büyük artısı bu.,Olumsuzlama
i̇lk aldığımda beğendim ama 2 sonra sapsarı iğrenç bi renk halini aldı.,Bağlamsal/Diğer
urun harika hepsiburada inanılmaz hızlı tesekkurler,Bağlamsal/Diğer
su kaynadığında cihaz otomatik olarak durmadığından; kaynar su dışarıya taşıyor. dolayısıyla tehlike doğuruyor. çocuğu olanlar ürünü alırken çok iyi düşünsünler. çay yaparken cihazın yakınınızda bulunmasını tavsiye etmem. bunun dışında sağlam kaliteli malzemeden üretilmiş.,Bağlamsal/Diğer
"aynı anlamlı cümlelerle bir süre sonra okumaktan sıkılabileceğiniz, ayrıca oldukça gereksiz şekilde kullanılan ünlem işareti ile kitabın size bağırarak bir şeyler anlatmaya çalıştığı yönünde bir izlenim bırakmakta.",Yazım Bozukluğu
"mutfak rafları için almıştım, boyu yüksek geldi mutfak rafında kullanamadım banyo ve gardırop için kullanmayı düşünüyorum. 5 cm kısa olsaydı daha kullanışlı olacaktı.",Bağlamsal/Diğer
"güncellenmesi lağzım. her gün kanal listesi kendi kendine değişiyor. tkgs yi kapalı yapsamda kanal listesi değişiyor. favori kanalları kendi keyfime göre oluşturmama, silmeme, yer değiştirmeme müsade etmiyor.",Bağlamsal/Diğer
kartın boyutlarına göre düşünülmemiş. kartı kesmeniz gerekir.,Bağlamsal/Diğer
i̇yi çalışmalar.,Kısa Yorum
"arkadaşlar ürün 2 gün içinde elime ulaştı, lastikleri çok güzel parlatıyor, 3 gün oldu parlaklık halen duruyor, anladığım kadarıyla tozda tutmuyor, alacak arkadaşlara tavsiye ederim.",Bağlamsal/Diğer
"led lambaların fiyatını soğutucu ve malzeme kalitesi belirler. oyuncak gibi bir şey. hafif , mikasıda iyi değildi.",Olumsuzlama
"ürün yeni elime geçti ve ürünün içerisinde açıklamalarda görülen saç şekilendirici olan aparat yoktu , diğer modelinde varmış .burada açıklama kısmında difüzör yok olarak yazıyor ama görsellerde var . şekilendirici kısmı bana çok lazımdı ürünün alma sebeblerimden birisiydi. yanılgıya düşmeyin alacak olanların bilgisine ...",Olumsuzlama
tavan kısmı düz olanlar için ideal ama bendeki gibi üstünde kemer olan salıncaklarda boyu kısa geliyor,Bağlamsal/Diğer
3-fps oyunlarinda genel olarak mouse bilek ile cevirilmez kol ile cevirilir hassasiyet diptedir. bu mouse ise hem agir hemde kol ile hizli cevrilince mevlana gibi donuyor.,Bağlamsal/Diğer
"i̇ki gün önce elime ulaşan ürünü gopro da kullanmak istedim ama pc ye aktarmak istediğimde sorun gösterdi ve pc de 27,4 gb kapasite diye gösteriyor format atsamda değişmedi. fakat kartın üzerinde 64 micro sd xc1 yazıyor sandisc ultra",Bağlamsal/Diğer
5- gündüz kamera çekim şahane (ama gece için aynısını diyemem),Bağlamsal/Diğer
galiba dört güzeller kitabı beni buyuledigi ve çıtayı yükselttiği için tatmin olmadım,Olumsuzlama
fan pin girisi az,Kısa Yorum
"ürünü aldım kullandım, süngerle lastiğe yedirirken köpürüyor sonra kuruyo ve lastik simsiyah(mat) oluyo. ben 3 kere uyguladım lastiklerin parladığını görmedim. tabiki eski halinden güzel oluyor. aracı gösteren lastik ve jantlardır her araca lazım.",Bağlamsal/Diğer
lastikler cok iyi...puani hepsiburadaya veriyorum...ucretsiz takma hizmeti yok kargo 10 gunde geldi...,Olumsuzlama
"tefalin giriş seviyesi buhar jeneratörlü ütüsü diyebiliriz. tabanı alüminyum levhadan yapılmış ölçüleri küçültülmüş, ağırlığı azaltılmış. eski tefal ütülere göre oyuncak gibi geliyor. buhar performansı iyi ancak kurutma makinesinde çok kurumuş kot pantolonlarda biraz bastırmak gerekiyor. yeni başlayan aileler için ideal. endüstriyel kullanılamaz. basit ev tipi cihaz. indirim yakalarsanız tavsiye ederim.",Bağlamsal/Diğer
diğer alıcıların yorumları tamamen doğru. renk konusunda seçme şansınız yok. benim en son tercihim geldi.,Olumsuzlama
yürümeyi sökmek üzere olan yeğenime 1 yaş hediyesi olarak aldık. fakat ilk denemede zorlandı. çünkü bunu kullandığında önü açık düz bir alan olmalı. manevra yapamaz. özelliklede yeni alanlar bebeğin düşmemesini sağlamalı yoksa olumsuz koşullanabilir.,Olumsuzlama
yani iyi yorum yapanlar neye göre yaptı çok merak ediyorum . telefonu alalı 1 hafta oldu telefonda donma ve kasmalar aşiri derecede var. kamerasında çogu ozellik kullanilamiyor. telefonun kendine ait bir suru işe yaramayan uygulamalari devamli güncelleme istiyor. gerçekten pişmanim alacak arkadaslara bu telefonu elemesini tavsiye ederim.,Bağlamsal/Diğer
"telefonu sipariş ettikten 1.5 gün sonra eline geçmesi gayet güzel. ancak aynı gece saat 2.30 sularında donması (ekrandaki saat dahi aynı kalıyor) ve alarmının bile çalmaması, açma kapama ardından yine aynı saatte birebir aynı şekilde donması ve konu ile ilgili samsungu aradığınızda servise getirin demeleri hiç de hoş değil. uğraş dur. hadi hayırlısı.",Olumsuzlama
"artısı: malzeme ve imalat kaliteli, uygun fiyat",Bağlamsal/Diğer
ses kalitesi kullanımı duruşu herşeyi güzel ancak açma ve kapama için olan düğmeye telefon çagrı konumunda degilken kazara basılırsa son numarayı tekrar arıyor tek kötü yanı bu bence,Karma Duygu
ürün fiyata göre orta seviyede her iki dumbell da 10 kg boyutlarının büyük olması hareketlerde sorun yaşatabilir .,Bağlamsal/Diğer
"3 günde eli̇mde oldu, fi̇yati bi̇raz pahali ama kampanyalar i̇le alinabilir oluyor. ben world kartin %15 ve play kartin %25 kampanyasi i̇le aldim epey bi̇r i̇ndi̇ri̇m oldu.",Bağlamsal/Diğer
fena değil diyecem çünkü bütün forumları internetteki yorumları filan araştırdım vede çok met ediyolar diye aldım çok sessiz sıfır ses gibi yorumlar okudum bazılarına sordum motordan hiç ses gelmiyo dediler ama baloncuklar ses yapabiliyor onuda kapatabiliyosunuz filan dediler hep ama ses var makinada baloncuklarda ses yapıyo alınca biraz hüsrana uğradım gece 12 den sonra da yatarken ses geliyo ama ben yatabiliyorum makinayla çok rahatsız etmiyo akvaryumun tepe motorunun ve baloncuklarının çıkardığı sesten yarı yarıya daha sesiz ama ses var yinede öyle anlattıkları gibi sıfır ses filanda değil bundan öncede 3701 kodlu hava motorunu aldım eheim ın oda sıfır ses filan değil yani ondanda hem motordan hemde baloncuklardan ses geliyo hatta bu iç filtrenin motoru daha sesli diyebilirim....bu sessizlikte çin malı ürünlerde almak mümkün bende daha öncede vardı marka diye aldık işte bide yorumlar hep sıfır ses yok böyle bi̇r şey,Olumsuzlama
"merhaba, ürünü sipariş ettim ve kısa sürede elime ulaştı, kullandım. küçük zift tanelerini çıkarıyor fakat büyük ve kurumuş zift tanelerinde başarısız.bence bu işi profesyonellere bırakmak gerekiyor.",Bağlamsal/Diğer
"nasır problemime iyi gelmesini umuyordum, ancak beklediğim performansı bulamadım. basliginin incelik seçenekleri ve hız ayarı eklenmesi gerekli.",Bağlamsal/Diğer
kullandığım süre boyunca çok memnundum. elektriklenme yapmadan saçlarımı düzleştirebiliyorum. ancak bir yıl içinde haftada sadece bir kez kullanmama rağmen arıza meydana geldi.,Yazım Bozukluğu
eğer fiyatı 5 tl olsaydı harika bir ürün diyebilirdim...,Bağlamsal/Diğer
3 - 4 mb ile yapıyor işlemleri,Bağlamsal/Diğer
1 tanesi 60-70 mb (orayda birkaç prog. olduğunu tahmin ediyorum),Bağlamsal/Diğer
kisa sürede eli̇me ulaşti sorun yok. teşekkürler hb.,Olumsuzlama
"merhaba arkadaşlar,",Kısa Yorum
ürün çok geldi.,Kısa Yorum
ürün çok kaliteli ancak 2 yıldız vermemin sebebi beden ler okadar küçükki 2xl nerdeyse medium boyutunda alırken buna dikkat...,Bağlamsal/Diğer
"braun satin hair boyalı saçlar için düzleştiricimin plakaları aşındığından (ki bu benim kötü kullanımımdan kaynaklıydı), yeni bir düzleştirici bakarken philip in bu ürününü gördüm. tekrar braun almayı düşünüyordum ancak bu ürünün iyon vs özelliği dikkatimi çekti ve sipariş verdim.",Bağlamsal/Diğer
bunun kadar elektrik yakan makine görmedim,Bağlamsal/Diğer
"yoksa ürüne lafım yok, oldukça güzel, ve faydalı.",Olumsuzlama
"bir daha alır mıyım hayır . ama felix bu otomat sorununu giderirse , ürün bence mükemmel olacak .",Bağlamsal/Diğer
çok iç acıcı değil ama genede biraz faydasını görürsünüz,Olumsuzlama
kalitesi fiyatıyla orantılı yani bu çay makinesinde kalite beklemeyin.i̇ki haftadır kullanıyorum su falan sızdırmıyor .alt tarafındaki plastik kısmı her an dağılacak gibi .birkaç sene bu markanın su ısıtıcısını kullandım sorun çıkarmadı.,Bağlamsal/Diğer
ürün orjinal zippo kalitesinde değil.çakmak taşı görevi gören sürttüğünüz yer belli bir süre sonra biten tarzda bir şey.çok kaliteli değil ama fiyatına uygun..,Olumsuzlama
ürün fiyatı uygun fakat düşündüğümden ve resimde göründüğünden daha küçük gibi geldi. henüz kullanmadım. inşallah iş görür.,Bağlamsal/Diğer
acılıp kapanırken takılı kalma sorunları var ancak fiyat performans olarak iyi durumda bazı plastik aksamlarının kalitesi düşük su gecirmez kabı güzel kullanışlı kask için aparat yok amatör kullanıcılar icin ideal bir ürün,Olumsuzlama
telefon konuşurken karşıdaki ses aracın hoporlerinden güzel geliyor ama arabadaki aux girişi aşağıda kalıyorsa karşı taraf sesin çok derinden geliyor diyor net olması için çok bağırmak gerek,Bağlamsal/Diğer
koku genel olarak bence güzel yani tam bir yaz kokusu ferah ve temizlik hissi veriyor fakat gelgelelim farkedilirlik ve kalıcılık konusunda kolonyadan farkı yok. gün içinde yarım saat aralıklarla tazeliyorum cebimde taşıyarak :) yazın tatilde kullanın ama onun dışında bence uzak durun.,Olumsuzlama
ürünü bir alışveriş merkezinde denemiştim ve hepsi burada com ürünlerinin orjinalliğinden hiç şüphem yoktu parfüm orjinal ama kalıcık konusunda istediğimi bulamadım...,Olumsuzlama
pek fark yaratan cinsten değil. kullanmış olmak için kullanmak isteyenlere,Olumsuzlama
konusu itibari ile okunmaya değmeyecek bir wattpad kitabı. belli bir yaşa hitap ediyor ve üzerinde yazmasa da yetişkin içerikli bir kitap. özellikle çocuklara okutmamanızı şiddetle tavsiye ederim!,Bağlamsal/Diğer
koku gayet uygun bir fiyata geldi bana hepsi buradanın kampanyaları sayesinde.yanlız cok ağır ve keskin bir koku yazın pek kullanılmaz belki kışın.,Yazım Bozukluğu
"ürün çok güzel su tasarruf yapıyor ama, kullanırken fıskiyeli olmasından dolayı, etrafa çok su sıçratıyor.",Bağlamsal/Diğer
gericinin önde gidenidir. ona göre değerlendirin,Bağlamsal/Diğer
sonuç olarak televi̇zyon karşisinda 10 dak tiraşin %80 i̇ni̇ halledi̇p geri̇ kalanini 2 daki̇kada ji̇letle üstünden geçi̇p i̇şlemi̇ bi̇ti̇rebi̇li̇yorsunuz.almak i̇steyenlere bu ürünü tavsi̇ye edi̇yorum.,Yazım Bozukluğu
kordonu çok uzun geldi. koluma uymadı. kordonu saatçiye baktırmam gerekiyor.,Bağlamsal/Diğer
tesli̇mat hizli ürün i̇se gayet kullanişli,Bağlamsal/Diğer
demlik örüntüsü niyetiyle su damlatmaz die aldım....,Bağlamsal/Diğer
ürünün içi beton dolu. 5 kg lik plakaların çapı 20 cm.barlar çok uzun. ürünü yere düşürürseniz patlayabilir dikkatli kullanmanız lazım.tek avantajı fiyatı.,Bağlamsal/Diğer
başka ürün kullanıyorduk denemek için aldık ama kızarıklık oldu. o yüzden bıraktık. bedeni iyi geldi. fiyatı çok uygun.,Bağlamsal/Diğer
